{
  "manifestVersion": 1,
  "artifactId": "artifact-contract-1",
  "gameTitleId": "title-contract-1",
  "inputRevision": "7",
  "algorithmVersion": "series-analysis-v9",
  "artifactSchemaVersion": 8,
  "sourceInputChecksum": "sha256:cccccccccccccccccccccccccccccccccccccccccccccccccccccccccccccccc",
  "rootChecksum": "sha256:4526c5c92e3d8cde8fe909eaed36cea3c2cd6eff8edcf0dfb53691ac15eb9c8c",
  "resources": [
    {
      "kind": "aggregate",
      "scope": {
        "kind": "overall"
      },
      "itemKey": "overall",
      "path": "aggregate-overall.json",
      "encodedBytes": 128,
      "decodedBytes": 128,
      "itemCount": 4,
      "nestingDepth": 5,
      "checksum": "sha256:aaaaaaaaaaaaaaaaaaaaaaaaaaaaaaaaaaaaaaaaaaaaaaaaaaaaaaaaaaaaaaaa"
    },
    {
      "kind": "review",
      "scope": {
        "kind": "overall"
      },
      "itemKey": "overall",
      "path": "review-overall.json",
      "encodedBytes": 64,
      "decodedBytes": 64,
      "itemCount": 0,
      "nestingDepth": 3,
      "checksum": "sha256:bbbbbbbbbbbbbbbbbbbbbbbbbbbbbbbbbbbbbbbbbbbbbbbbbbbbbbbbbbbbbbbb"
    },
    {
      "kind": "drilldown",
      "scope": {
        "kind": "season_map",
        "seasonMasterId": "season-1",
        "mapMasterId": "map-1"
      },
      "itemKey": "member-1:rank.average_history",
      "path": "drilldown-member-1-rank-average-history.json",
      "memberId": "member-1",
      "metricId": "rank.average_history",
      "encodedBytes": 96,
      "decodedBytes": 96,
      "itemCount": 1,
      "nestingDepth": 4,
      "checksum": "sha256:dddddddddddddddddddddddddddddddddddddddddddddddddddddddddddddddd"
    },
    {
      "kind": "match_context",
      "scope": {
        "kind": "overall"
      },
      "itemKey": "match-1",
      "path": "match-context-match-1-overall.json",
      "matchId": "match-1",
      "sourceMatchRevision": "2",
      "encodedBytes": 160,
      "decodedBytes": 160,
      "itemCount": 1,
      "nestingDepth": 6,
      "checksum": "sha256:eeeeeeeeeeeeeeeeeeeeeeeeeeeeeeeeeeeeeeeeeeeeeeeeeeeeeeeeeeeeeeee"
    },
    {
      "kind": "outlook_summary",
      "scope": {
        "kind": "overall"
      },
      "itemKey": "overall",
      "path": "outlook-summary-overall.json",
      "encodedBytes": 128,
      "decodedBytes": 128,
      "itemCount": 4,
      "nestingDepth": 8,
      "checksum": "sha256:ffffffffffffffffffffffffffffffffffffffffffffffffffffffffffffffff"
    },
    {
      "kind": "outlook_reference",
      "scope": {
        "kind": "overall"
      },
      "itemKey": "member-1",
      "path": "outlook-reference-member-1.json",
      "encodedBytes": 128,
      "decodedBytes": 128,
      "itemCount": 4,
      "nestingDepth": 8,
      "checksum": "sha256:ffffffffffffffffffffffffffffffffffffffffffffffffffffffffffffffff",
      "memberId": "member-1"
    },
    {
      "kind": "achievements",
      "scope": {
        "kind": "overall"
      },
      "itemKey": "achievements",
      "path": "achievements-overall.json",
      "encodedBytes": 128,
      "decodedBytes": 128,
      "itemCount": 0,
      "nestingDepth": 8,
      "checksum": "sha256:1111111111111111111111111111111111111111111111111111111111111111"
    }
  ]
}
